{"items":[{"intent":"add_collection_point","params":{"label":"Online checkout form","node_id":"n1","x":80,"y":80}},{"intent":"add_node","params":{"label":"Shopify","node_id":"n2","type":"system","x":310,"y":80}},{"intent":"add_node","params":{"label":"Klaviyo","node_id":"n3","type":"thirdparty","x":545,"y":80}},{"intent":"connect","params":{"a":"n1","b":"n2","cat":"contact"}},{"intent":"connect","params":{"a":"n2","b":"n3","cat":"marketing"}},{"intent":"set_retention","params":{"as_of":"2026-10-04","node_id":"n2","range_max_years":7,"range_min_years":6,"record_type":"Quebec tax books and records","statute":"Loi sur l'administration fiscale, RLRQ, c. A-6.002, ss. 34, 35.3"}},{"intent":"run_check","params":{"checks":["label_coverage","connectivity","retention_cited","edge_categories"]}},{"intent":"export","params":{"format":"xls"}}],"name":"Cafe Nord sample: checkout form to Shopify to Klaviyo","recipe_id":"cafe-nord-sample-01","schema_version":"1.0.0"}